{
  "$schema": "http://json-schema.org/draft-07/schema#",
  "title": "Session tool-discovery fixture",
  "description": "Schema for captured evidence and unverified target specifications under tests/fixtures/session-tool-discovery/. Fixture tool lists remain independent of this repo's manifest source, so compatibility checks can compare 'globally registered' against 'discoverable in a session' without deriving one from the other.",
  "type": "object",
  "required": ["$schema", "fixtureId", "adapter", "status", "provenance", "runtimeMcpPresent", "gatewayAttached", "discoveredTools"],
  "additionalProperties": false,
  "properties": {
    "$schema": {
      "type": "string",
      "const": "./session-tool-discovery.schema.json"
    },
    "fixtureId": { "type": "string", "minLength": 1 },
    "adapter": { "type": "string", "minLength": 1 },
    "status": {
      "type": "string",
      "enum": ["captured-incident", "target-not-captured"],
      "description": "Whether this fixture records an actually-observed session result ('captured-incident') or is merely a hand-authored specification of a not-yet-verified target state ('target-not-captured'). Consumers must not treat a 'target-not-captured' fixture as proof any real session behaves this way."
    },
    "provenance": {
      "type": "object",
      "required": ["source", "capturedAt", "capturedBy", "note"],
      "additionalProperties": false,
      "properties": {
        "source": { "type": "string", "minLength": 1 },
        "capturedAt": { "type": "string", "minLength": 1 },
        "capturedBy": { "type": "string", "minLength": 1 },
        "note": { "type": "string", "minLength": 1 }
      }
    },
    "runtimeMcpPresent": { "type": "boolean" },
    "gatewayAttached": { "type": "boolean" },
    "discoveredTools": {
      "type": "array",
      "items": { "type": "string", "minLength": 1 },
      "description": "The literal tool names an agent session could actually call via tools/list, as observed/captured for this adapter state. Deliberately a flat string list independent of any manifest-derived type, so drift between registration and discovery is detectable."
    }
  }
}
