{
  "$schema": "./session-tool-discovery.schema.json",
  "fixtureId": "target-codex_local",
  "adapter": "codex_local",
  "status": "target-not-captured",
  "provenance": {
    "source": "DRO-1163 target/expected-state specification (NOT a captured session result)",
    "capturedAt": "n/a -- not captured from any real run",
    "capturedBy": "hand-authored spec of the desired post-fix behavior; no codex_local session has ever produced this tools/list",
    "note": "THIS IS NOT EVIDENCE. This fixture only documents what tools/list SHOULD contain once paperclipai/paperclip#10346 is fixed upstream and a real codex_local session attaches the gateway MCP server. Per DRO-1163 review, a hypothetical fixture cannot be treated as proof that the healthy path works, and this repo has no way to exercise Paperclip core's codex_local adapter to capture a real one. This file exists only to express the target shape for a future real capture to replace once #10346 ships; the spec that consumes it must not claim the healthy path is verified."
  },
  "runtimeMcpPresent": true,
  "gatewayAttached": true,
  "discoveredTools": [
    "shell",
    "read_file",
    "list_directory",
    "github_bot_whoami",
    "github_bot_create_pull_request",
    "github_bot_push_branch",
    "github_bot_submit_pull_request_review",
    "github_bot_add_issue_comment",
    "github_bot_list_issue_comments",
    "github_bot_get_issue",
    "github_bot_update_issue",
    "github_bot_get_pull_request",
    "github_bot_list_pull_request_files",
    "github_bot_list_organization_projects",
    "github_bot_add_pull_request_to_project",
    "github_bot_assign_to_current_user",
    "github_bot_update_pull_request",
    "github_bot_get_pull_request_checks",
    "github_bot_request_pull_request_reviewers",
    "github_bot_reply_to_review_thread",
    "github_bot_resolve_review_thread",
    "github_bot_unresolve_review_thread",
    "github_bot_list_pull_request_review_threads",
    "github_bot_search_repository_items",
    "github_bot_upload_pull_request_asset",
    "github_bot_get_issue_interaction_summary",
    "github_bot_link_github_item"
  ]
}
